orig,kr
広く普及している木製の竪琴。しかし、一たび魔の旋律を奏でれば、それは戦場を支配する武器となる。,널리 보급된 나무 하프。그러나 일단 마의 선율을 연주하면 그것은 전장을 지배하는 무기가 된다。

苦無,쿠나이
忍びになりたいか？それなら、一に、この暗器を使いこなすこと。二に、ござる口調を止めることだ。,"닌자가 되고 싶은가？그렇다면, 첫째, 이 암기를 잘 다루어라。둘째, ""올시다""같은 말투는 집어치워라。"

太刀,태도
この刀を見て、華奢と笑うか。ならば、我が刀を振り抜き、汝の身体と汝の堅き鎧を共に斬りても、笑みを消さぬままいられるか。,"이 칼을 보고도 웃는 것인가。그렇다면 내 칼을 뽑아 그대의 몸과 갑옷을 베어내도, 웃음을 지우지 않고 있을 수 있겠는가。"

ウェポンミラージュ,웨폰 미라지
武器が宿した力はひとつ所へ集まり、やがてこの宝玉に辿り着く。その輝きは数多の武器へと受け継がれ、新たな力となる。,무기에 깃든 힘이 한데 모여 이윽고 이 보옥으로 변화한다. 그 빛은 수많은 무기에 계승되어 새로운 힘이 된다
ウェポンミラージュを強化素材として使用することで、ベースとなる武器にボーナス値が付与されます。武器のボーナス値の上限は「+**」で、「+*」ごとに「攻撃力+*」、「HP+*」ずつステータスが上昇します。,"<span style=""font-size: 65%"">웨폰 미라지를 강화소재로 사용하는 것으로 베이스가 되는 무기에 보너스 값이 부여됩니다. 무기 보너스 값의 상한은 「+**」이며 「+*」마다 「공격력+*」, 「HP+*」씩 스테이터스가 상승됩니다다</span>"
