Language,SceneCode,Type,Name,Origin,Korean
English,"scene_evt200628_cp5_q2_s10,7556521",detail,,[Djeeta] carries Amira back to her room with Vyrn and Lyria's help.
English,"scene_evt200628_cp5_q2_s10,7556521",detail,,The rest of the crew then have dinner together.
English,"scene_evt200628_cp5_q2_s10,7556521",detail,,"After the main course, lumber jellato is brought out for dessert."
English,"scene_evt200628_cp5_q2_s10,7556521",detail,Lyria,Mmm! The coldness and the firm texture are so good together!
English,"scene_evt200628_cp5_q2_s10,7556521",detail,Vyrn,A perfect treat for a hot summer day!
English,"scene_evt200628_cp5_q2_s10,7556521",detail,Charlotta,"Your cooking once again exceeds expectations, Sevastien!"
English,"scene_evt200628_cp5_q2_s10,7556521",detail,Sevastien,Why thank you for your kind compliment.
English,"scene_evt200628_cp5_q2_s10,7556521",detail,Sevastien,"I have more prepared for everyone else, should you wish to partake."
English,"scene_evt200628_cp5_q2_s10,7556521",detail,Redluck,"Thanks for the offer, but I think I'll go off and have a drink by myself."
English,"scene_evt200628_cp5_q2_s10,7556521",detail,Kolulu,I'm... Yawn... Pretty sleepy...
English,"scene_evt200628_cp5_q2_s10,7556521",detail,Sevastien,"Oh dear. In that case, if there's anyone who would like seconds..."
English,"scene_evt200628_cp5_q2_s10,7556521",detail,Lucio,Pardon me. May I request a portion for myself?
English,"scene_evt200628_cp5_q2_s10,7556521",detail,,Lucio smiles at Sevastien as he closes the door behind himself.
English,"scene_evt200628_cp5_q2_s10,7556521",detail,Vyrn,"Finally decided to show up, huh? Sorry, pal, but we've almost finished all the food off."
English,"scene_evt200628_cp5_q2_s10,7556521",detail,Lucio,That is no issue whatsoever. I finished dining before I returned.
English,"scene_evt200628_cp5_q2_s10,7556521",detail,Vyrn,Works out then. Why the heck were you out so late?
English,"scene_evt200628_cp5_q2_s10,7556521",detail,Lucio,"I haven't had many chances to exercise recently, therefore I decided to engage in a bit of intense activity."
English,"scene_evt200628_cp5_q2_s10,7556521",detail,Lucio,"Sandy would scold me for being unseemly if I did not maintain my physical form, after all."
English,"scene_evt200628_cp5_q2_s10,7556521",detail,Vyrn,"Yeah, he probably would, wouldn't he?"
English,"scene_evt200628_cp5_q2_s10,7556521",detail,Vyrn,Shouldn't you skip dessert then?
English,"scene_evt200628_cp5_q2_s10,7556521",detail,Lucio,There's always room for dessert. Isn't that how the saying goes?
English,"scene_evt200628_cp5_q2_s10,7556521",detail,Vyrn,Yep. Those were the last words of many brave dieters.
English,"scene_evt200628_cp5_q2_s10,7556521",detail,,Lucio puts a finger to his lips and winks.
English,"scene_evt200628_cp5_q2_s10,7556521",detail,,"Night still young, the remaining crew members enjoy their desserts together."
English,"scene_evt200628_cp5_q3_s10,7556531",synopsis,,"Redluck drinks alone on the deck of the ship after dinner. [Djeeta], Vyrn, and Lyria watch him worriedly from a hidden spot, unsure of how to approach him, but he notices them anyway and beckons them over. The three express their concern, and Redluck speaks of both his dream for helping starving individuals, as well as his own personal desire to win the competition. However, now that his own chance is over, he resolves to wholeheartedly support Kolulu in her own victory."
English,"scene_evt200628_cp5_q3_s10,7556531",detail,Redluck,Phew... Evening breeze sure feels nice.
English,"scene_evt200628_cp5_q3_s10,7556531",detail,,"Drink in hand, Redluck leans against the railing on the ship's deck and stares into the distance."
English,"scene_evt200628_cp5_q3_s10,7556531",detail,,His normally cheerful expression is clouded with melancholy.
English,"scene_evt200628_cp5_q3_s10,7556531",detail,,"From a hidden spot nearby, [Djeeta] and friends watch worriedly over him."
English,"scene_evt200628_cp5_q3_s10,7556531",detail,Vyrn,Definitely set some alarm bells off when he said he wanted to drink alone.
English,"scene_evt200628_cp5_q3_s10,7556531",detail,Lyria,How should we approach this? He almost seems like a different person.
English,"scene_evt200628_cp5_q3_s10,7556531",detail,Vyrn,The shock of losing musta been more serious than he let on.
English,"scene_evt200628_cp5_q3_s10,7556531",detail,Redluck,Hm... Is someone over there?
English,"scene_evt200628_cp5_q3_s10,7556531",detail,,"Knowing the jig is up, the hidden crew members sheepishly emerge from their hiding spot."
English,"scene_evt200628_cp5_q3_s10,7556531",detail,Lyria,Ahaha... F-fancy seeing you here...
English,"scene_evt200628_cp5_q3_s10,7556531",detail,Redluck,"Oh, it's just you all. Did you need me for something?"
English,"scene_evt200628_cp5_q3_s10,7556531",detail,Vyrn,"Not exactly, but, uh..."
English,"scene_evt200628_cp5_q3_s10,7556531",detail,Redluck,Ah. Came here to check on me then.
English,"scene_evt200628_cp5_q3_s10,7556531",detail,Vyrn,"I mean, you were super into the whole competition, and winning, and..."
English,"scene_evt200628_cp5_q3_s10,7556531",detail,Redluck,"Hey, no need to get upset. It's my loss, not yours."
English,"scene_evt200628_cp5_q3_s10,7556531",detail,Lyria,That doesn't mean we can't be sad too! It hurts to see you not happy...
English,"scene_evt200628_cp5_q3_s10,7556531",detail,Redluck,Is that right? Can't say I didn't expect that from you kids.
English,"scene_evt200628_cp5_q3_s10,7556531",detail,,Redluck smiles fondly for a moment before his expression turns somber.
English,"scene_evt200628_cp5_q3_s10,7556531",detail,Redluck,It was my dream.
English,"scene_evt200628_cp5_q3_s10,7556531",detail,Redluck,"You can't tell anyone else this, all right? Especially not our championship competitors."
English,"scene_evt200628_cp5_q3_s10,7556531",detail,Redluck,"But I was prepared to stake my life on this competition and, like you guessed, the shock of losing was hard."
English,"scene_evt200628_cp5_q3_s10,7556531",detail,Redluck,The only reason this competition happened was because of the situation with the lumber jellies.
English,"scene_evt200628_cp5_q3_s10,7556531",detail,Redluck,"There's always a chance the event will be revived if this one is successful enough, but that's not a chance I can count on."
English,"scene_evt200628_cp5_q3_s10,7556531",detail,Redluck,So I went into this expecting it to be my first and last attempt at taking the title.
English,"scene_evt200628_cp5_q3_s10,7556531",detail,Redluck,Part of why I wanted it so bad was to help create a world where no one ever has to starve.
English,"scene_evt200628_cp5_q3_s10,7556531",detail,Redluck,"On the other hand, I simply wanted to win for myself as a competitive eater."
English,"scene_evt200628_cp5_q3_s10,7556531",detail,Redluck,"Seems like such a small thing, right? But dreams are special things. Make anything seem gigantically significant."
English,"scene_evt200628_cp5_q3_s10,7556531",detail,Redluck,Especially when it's one you've always chased after since you were a kid.
English,"scene_evt200628_cp5_q3_s10,7556531",detail,Redluck,And it was so close to coming true. I could feel it. That's why the loss hit me so hard.
English,"scene_evt200628_cp5_q3_s10,7556531",detail,Vyrn,Big guy...
English,"scene_evt200628_cp5_q3_s10,7556531",detail,Redluck,Gahaha! Sorry to bore you with the long story.
English,"scene_evt200628_cp5_q3_s10,7556531",detail,Redluck,Didn't mean to ramble like that. You guys are such good listeners!
English,"scene_evt200628_cp5_q3_s10,7556531",detail,,Redluck laughs sheepishly while the others smile back.
English,"scene_evt200628_cp5_q3_s10,7556531",detail,Lyria,Your dream's not over yet though.
English,"scene_evt200628_cp5_q3_s10,7556531",detail,Redluck,Hm?
English,"scene_evt200628_cp5_q3_s10,7556531",detail,Lyria,"You've passed the torch to Kolulu, and she's going to run with it."
English,"scene_evt200628_cp5_q3_s10,7556531",detail,Lyria,"With your help, she's carrying your dreams forward."
English,"scene_evt200628_cp5_q3_s10,7556531",detail,Lyria,"Whatever you couldn't do alone before, she's there to help you finish."
English,"scene_evt200628_cp5_q3_s10,7556531",detail,Lyria,So... there's still hope.
English,"scene_evt200628_cp5_q3_s10,7556531",detail,Redluck,...
English,"scene_evt200628_cp5_q3_s10,7556531",detail,Redluck,"Haha... Didn't think of it that way, but you're absolutely right."
English,"scene_evt200628_cp5_q3_s10,7556531",detail,Redluck,Can't be moping around if I want to witness her seeing things through!
English,"scene_evt200628_cp5_q3_s10,7556531",detail,Vyrn,It's not gonna be easy with Amira there too. She's one tough cookie.
English,"scene_evt200628_cp5_q3_s10,7556531",detail,Redluck,"Right, right. She's got some mysterious abilities at work."
English,"scene_evt200628_cp5_q3_s10,7556531",detail,Redluck,I might've ended up having as much trouble with her as I did with Mash.
English,"scene_evt200628_cp5_q3_s10,7556531",detail,Vyrn,"Well, Kolulu and Amira are both our friends, right? Doesn't matter to me which one wins—I'm ready to cheer 'em on!"
English,"scene_evt200628_cp5_q3_s10,7556531",detail,Lyria,"Hehe, tomorrow is going to be so much fun!"
English,"scene_evt200628_cp5_q3_s10,7556531",detail,,"Their bonds deepened, the crew now understand Redluck better than before."
English,"scene_evt200628_cp5_q3_s10,7556531",detail,,A new smile adorns Redluck's face as he takes comfort in his friends.
English,"scene_evt200628_cp5_q4_s10,7556541",synopsis,,"Kolulu, unable to sleep, accidentally overhears Redluck's true feelings. Amira walks up and startles Kolulu, sending her tumbling onto the deck and revealing herself. Redluck speaks with her, and afterward Kolulu expresses her intent to win is stronger than ever. Amira and Kolulu both refuse to cede victory to the other and prepare themselves for an intense final round."
English,"scene_evt200628_cp5_q4_s10,7556541",detail,Kolulu,...
English,"scene_evt200628_cp5_q4_s10,7556541",detail,,"Hidden behind a door leading out to the deck, Kolulu unexpectedly hears Redluck's heartfelt admission."
English,"scene_evt200628_cp5_q4_s10,7556541",detail,Kolulu,"Master, you wished to win so badly..."
English,"scene_evt200628_cp5_q4_s10,7556541",detail,Kolulu,And I... took that opportunity away from you.
English,"scene_evt200628_cp5_q4_s10,7556541",detail,Amira,What are you doing?
English,"scene_evt200628_cp5_q4_s10,7556541",detail,Kolulu,Golly!
English,"scene_evt200628_cp5_q4_s10,7556541",detail,,Kolulu jumps at the unexpected voice from behind and falls through the door onto the deck.
English,"scene_evt200628_cp5_q4_s10,7556541",detail,Kolulu,Owchies...
English,"scene_evt200628_cp5_q4_s10,7556541",detail,Amira,Are you okay?
English,"scene_evt200628_cp5_q4_s10,7556541",detail,Kolulu,I-it's nothing worth worrying over.
English,"scene_evt200628_cp5_q4_s10,7556541",detail,,"As Amira helps Kolulu up, a large shadow falls over the two."
English,"scene_evt200628_cp5_q4_s10,7556541",detail,Redluck,"So... You heard everything, I'm guessing."
English,"scene_evt200628_cp5_q4_s10,7556541",detail,Kolulu,"Ah, um... Well..."
English,"scene_evt200628_cp5_q4_s10,7556541",detail,Kolulu,I couldn't sleep because I was feeling antsy and then I heard your voices coming from the deck...
English,"scene_evt200628_cp5_q4_s10,7556541",detail,Amira,What were you talking about?
English,"scene_evt200628_cp5_q4_s10,7556541",detail,Vyrn,The big guy's feelings. Didn't you hear?
English,"scene_evt200628_cp5_q4_s10,7556541",detail,Amira,No. I was looking for snacks.
English,"scene_evt200628_cp5_q4_s10,7556541",detail,Redluck,...
English,"scene_evt200628_cp5_q4_s10,7556541",detail,Redluck,I didn't want unnecessary pressure weighing you down. That's why I didn't want to tell you any of it.
English,"scene_evt200628_cp5_q4_s10,7556541",detail,Kolulu,...
English,"scene_evt200628_cp5_q4_s10,7556541",detail,Redluck,But cat's out of the bag now. May as well tell it to you directly.
English,"scene_evt200628_cp5_q4_s10,7556541",detail,Redluck,"The loss hurt, no doubt about it. It was paralyzing."
English,"scene_evt200628_cp5_q4_s10,7556541",detail,Redluck,"Felt like someone put out the fire in me, and I had no fuel to keep going."
English,"scene_evt200628_cp5_q4_s10,7556541",detail,Redluck,But seeing your determination reignited that fire. I realized it was too early to give up.
English,"scene_evt200628_cp5_q4_s10,7556541",detail,Redluck,So... show me my dream still has a chance to come true.
English,"scene_evt200628_cp5_q4_s10,7556541",detail,Redluck,"Go out and bring home the win. I believe in you, Kolulu."
English,"scene_evt200628_cp5_q4_s10,7556541",detail,Kolulu,Master...
English,"scene_evt200628_cp5_q4_s10,7556541",detail,Kolulu,Understood! I've made up my mind!
English,"scene_evt200628_cp5_q4_s10,7556541",detail,Kolulu,I shall eat with everything I've got and emerge victorious!
English,"scene_evt200628_cp5_q4_s10,7556541",detail,Redluck,"Yeah, that's the attitude I want to see!"
English,"scene_evt200628_cp5_q4_s10,7556541",detail,Amira,Victory...
English,"scene_evt200628_cp5_q4_s10,7556541",detail,Kolulu,"Of course I intend to take the victory, even if it's against you, Amira!"
English,"scene_evt200628_cp5_q4_s10,7556541",detail,Amira,I won't lose.
English,"scene_evt200628_cp5_q4_s10,7556541",detail,Amira,I have to become famous and make sure Mother hears about me.
English,"scene_evt200628_cp5_q4_s10,7556541",detail,Kolulu,Amira...
English,"scene_evt200628_cp5_q4_s10,7556541",detail,,"With nothing else left to say, Amira turns and heads belowdecks."
English,"scene_evt200628_cp5_q4_s10,7556541",detail,Kolulu,We both have our reasons to come out on top.
English,"scene_evt200628_cp5_q4_s10,7556541",detail,Kolulu,"However, I won't yield to anyone!"
English,"scene_evt200628_cp5_q4_s10,7556541",detail,,Both crew members' minds are made up.
English,"scene_evt200628_cp5_q4_s10,7556541",detail,,"They steel themselves for the coming battle, knowing that only one person will claim the championship title."
