Language,SceneCode,Type,Name,Origin,Korean
Japanese,scene_tutorial05,detail,카타리나,――ふむ、一通りの武器が<br>手に入ったようだな。,"――흠, 어느정도 무기가<br> 입수된 것 같군."
Japanese,scene_tutorial05,detail,셰로카르테,武器には、基本的なものとして<br>剣、短剣、槍、斧、杖、銃、格闘具など<br>色々な種類がありまして～,"무기에는, 기본적인 물품으로 <br>검, 단검, 창, 도끼, 지팡이, 총, 격투기 등 <br> 여러 종류가 있어서요~"
Japanese,scene_tutorial05,detail,셰로카르테,他にも扱いが難しいものとして<br>弓、楽器、刀……といった武器も含め<br>全部で10種類ほどがありますよ～<br>,"그 밖에도 취급이 어려운 것으로<br>활, 악기, 도……와 같은 무기도 포함해<br>모두 10종류 정도가 있어요~<br>"
Japanese,scene_tutorial05,detail,셰로카르테,自分のジョブによって、<br>得意武器の種類が変わるから、<br>要注意です～,"자신의 작업에 따라,<br>특기무기의 종류가 바뀌니까,<br>요주의～"
Japanese,scene_tutorial05,detail,카타리나,やったぞ！<br>召喚石も手に入っているな！,좋아!<br>소환석도 구했군!
Japanese,scene_tutorial05,detail,카타리나,これはバトルで、<br>星晶獣を呼ぶために必要なものだ。<br>バトルの流れを大きく左右するぞ。,이건 배틀에서 <br>성정수를 부르기 위해 필요해.<br>배틀의 흐름을 크게 좌우하지.
Japanese,scene_tutorial05,detail,셰로카르테,武器も召喚石も、<br>装備しないと意味がないので、<br>これまた要注意です～,무기도 소환석도<br>장비하지 않으면 의미가 없기 때문에<br>또한 요주의입니다～
Japanese,scene_tutorial05,detail,셰로카르테,それじゃぁ、さっそく<br>ここで装備していっちゃいましょ～！,"그럼, 바로<br>여기서 장비합시다~!"
