Language,SceneCode,Type,Name,Origin,Korean
Japanese,"scene_evt190627_cp4_q1_s10,7428411",synopsis,,ブルースの騒動から多少の月日が経った頃、バカンスシーズンが本格的になり、<span class='scene-font-place'>アウギュステ</span>の観光客は更に活気に満ちていた。しかし突如地震が発生したかと思うと、沖合に空から隕石が落ちてくるのだった。,"브루스 소동으로부터 약간의 세월이 지났을 때, 바캉스 시즌이 본격적으로 시작되고, <span class='scene-font-place'>아우규스테</span>의 관광객은 다시 활기에 가득차있었다. 하지만 갑자기 지진이 발생했나 생각하고있으니, 앞바다의 하늘에서 운석이 떨어지는 것이었다."
Japanese,"scene_evt190627_cp4_q1_s10,7428411",detail,,<span class='scene-font-katari'>ブルースによる騒動後、</span><br><span class='scene-font-katari'>多少の月日が経った頃……</span>,<span class='scene-font-katari'>브루스가 일으킨 소동이 끝나고 며칠이 지났을 때였다.</span>
Japanese,"scene_evt190627_cp4_q1_s10,7428411",detail,,<span class='scene-font-katari'>バカンスシーズンも本格的になり、</span><br><span class='scene-font-katari'>観光客は更に活気に満ちていった。</span>,<span class='scene-font-katari'>본격적인 바캉스 시즌에 접어들자 관광객들은 더욱더 활기를 띠고 있었다.</span>
Japanese,"scene_evt190627_cp4_q1_s10,7428411",detail,청년,ははは！<br>まだ怒ってるのかい？<br>そろそろ機嫌を直せよ。,(하하하! 아직도 화가 난 거야? 그만 기분 풀어.)
Japanese,"scene_evt190627_cp4_q1_s10,7428411",detail,미녀,血糊なんて悪趣味だわ。<br>あの時は本当に怖かったんだから。,(그런 수를 쓰다니 악취미야. 그 땐 정말 무서웠단 말이야.)
Japanese,"scene_evt190627_cp4_q1_s10,7428411",detail,청년,僕がサメの餌食になったって？<br>そこまで心配するのは僕に本気の証拠？,(내가 상어밥이 된 줄 알았어? 그렇게 걱정한다는 건 내게 마음이 있다는 증거지?)
Japanese,"scene_evt190627_cp4_q1_s10,7428411",detail,미녀,心配だったのは船の操縦。<br>あなたがいないと私は沖で漂流生活よ。,(걱정한 건 배 운전 쪽이었어. 당신이 없으면 난 바다 한가운데에서 표류생활이라고.)
Japanese,"scene_evt190627_cp4_q1_s10,7428411",detail,청년,参ったなぁ。<br>でも噂によるとブルースは死んだんだ。<br>ここは完全に人間様の楽園になった！,(이런 이런. 하지만 소문에 의하면 브루스는 죽었다더군. 여긴 완전히 인간들의 낙원이 된 거야!)
Japanese,"scene_evt190627_cp4_q1_s10,7428411",detail,청년,ヒュウ！,휴!
Japanese,"scene_evt190627_cp4_q1_s10,7428411",detail,미녀,あ、ちょっと……！<br>サメ自体はまだ普通にいるのよ！,"(아, 기다려...! 상어 자체는 아직 남아 있단 말이야!)"
Japanese,"scene_evt190627_cp4_q1_s10,7428411",detail,청년,平気平気！<br>僕は柔術の有段者でね。<br>何が起きても寝技で一発さ。,(괜찮아. 나는 유도 유단자거든. 무슨 일이 있어도 기술만 걸면 한 방이야!)
Japanese,"scene_evt190627_cp4_q1_s10,7428411",detail,청년,さぁ君も一緒に──,"(자, 너도 같이...)"
Japanese,"scene_evt190627_cp4_q1_s10,7428411",detail,미녀,きゃあ！<br>地震だわ……！？,(꺄아! 지진이야...!)
Japanese,"scene_evt190627_cp4_q1_s10,7428411",detail,청년,海で地震……？<br>たぶん海底火山か何か──,(바다에서 지진...? 아마 해저 화산인지 뭔지가...)
Japanese,"scene_evt190627_cp4_q1_s10,7428411",detail,미녀,何……？<br>なんなのあの……ねえ……,(뭐야..? 뭐야 저건... 대체...)
Japanese,"scene_evt190627_cp4_q1_s10,7428411",detail,청년,嘘だろ？<br>空に火の玉が飛んで……<br>どんどん近づいてるぞ！？,(말도 안 돼. 하늘에서 불의 공이... 점점 우릴 향해 날아오고 있어!)
Japanese,"scene_evt190627_cp4_q1_s10,7428411",detail,미녀,<span class='scene-font-4'>きゃあぁぁぁ！？</span>,<span class='scene-font-4'(꺄아아아악！？)</span>
Japanese,"scene_evt190627_cp4_q2_s10,7428421",synopsis,,屋台の経営を続ける[플레이어]一行。そこにサリエルのお陰で生き残ったサメハンターが様子を見に来る。サメハンターは女性達から英雄ともてはやされていたが、海洋学者とは再び喧嘩中らしい。そこにサリエルが現れ、大量のブドウを買い求め去っていく。ルシオはその様子を不審に思い、屋台をサンダルフォン達に任せその場を離れるのだった。,"노점 경영을 계속하는 [플레이어] 일행. 거기에 사리엘 덕분에 살아남은 상어 헌터가 찾아온다. 상어 사냥꾼은 여성들로부터 영웅으로서 인기를 끌고 있었지만, 해양학자와 다시 싸움을 했다는 것 같다. 거기에 사리엘이 나타나 대량의 포도를 구입해 떠나간다. 루시오는 그 모습을 의심스럽게 생각해, 노점을 산달폰에게 맡기고 그 자리를 떠나는 것이었다."
Japanese,"scene_evt190627_cp4_q2_s10,7428421",detail,,<span class='scene-font-katari'>平和が戻った浜辺にて、</span><br><span class='scene-font-katari'>再び屋台を続けている一行。</span>,<span class='scene-font-katari'>평화를 되찾은 해변가에서 일행은 다시 노점을 열고 있었다.</span>
Japanese,"scene_evt190627_cp4_q2_s10,7428421",detail,,<span class='scene-font-katari'>店長のサンダルフォンは徐々に、</span><br><span class='scene-font-katari'>臨機応変に対応できるようになり……</span>,<span class='scene-font-katari'>점장 산달폰은 점점 임기응변에 능숙해져 갔는데...</span>
Japanese,"scene_evt190627_cp4_q2_s10,7428421",detail,산달폰,[플레이어]。<br>かき氷ワンＯＫだ。<br>あの黒い水着の女性に頼む。,"[플레이어], 원 빙수 OK다. 저 검은 수영복 여성에게 전달 부탁한다."
Japanese,"scene_evt190627_cp4_q2_s10,7428421",detail,루시오,店長。<br>ひとまず宣伝は完了ですね。<br>次は何を？,점장. 일단 선전은 끝냈습니다. 다음엔 뭘 하죠?
Japanese,"scene_evt190627_cp4_q2_s10,7428421",detail,산달폰,ではリンゴの皮を剥き、<br>いつでもすりおろせる準備を。,그럼 사과 껍질을 깎아서 언제든지 갈 수 있게 준비해 둬.
Japanese,"scene_evt190627_cp4_q2_s10,7428421",detail,루리아,店長！<br>リンゴがワンとメロンをツーです！,"점장! 원 사과, 투 메론이요!"
Japanese,"scene_evt190627_cp4_q2_s10,7428421",detail,산달폰,了解だ。<br>メロンは初めて完売する調子だな。,알았다. 메론은 처음으로 매진될 것 같군.
Japanese,"scene_evt190627_cp4_q2_s10,7428421",detail,비,店長もなかなか板についてきたぜ。<br>注文を回せるようになってきてよ。<br>後は水着になりゃあ完璧なんだけど。,점장도 꽤나 익숙해졌네. 주문도 잘 소화하고 말야. 이제 수영복만 입으면 완벽할 텐데.
Japanese,"scene_evt190627_cp4_q2_s10,7428421",detail,산달폰,別にいいだろう。<br>君等の要望どおり鎧は脱いだんだ。,상관없잖아. 너희 요청대로 갑옷은 벗었고.
Japanese,"scene_evt190627_cp4_q2_s10,7428421",detail,비,でもなんかカタイって言うかさ。<br>せめてサンダルに履き替えろよ。<br>サンダルフォンの名が泣いてるぜ！,그치만 뭔가 딱딱하달까? 적어도 샌들로 갈아신으라고. 샌들폰이라는 이름이 운다!
Japanese,"scene_evt190627_cp4_q2_s10,7428421",detail,산달폰,フン……<br>駄洒落のつもりか？,흥... 그것도 말장난이라고 하는 건가?
Japanese,"scene_evt190627_cp4_q2_s10,7428421",detail,산달폰,ルリア。<br>リンゴワンメロンツーだ。,루리아. 원 사과 투 메론 나간다.
Japanese,"scene_evt190627_cp4_q2_s10,7428421",detail,루리아,は～い！,네~에!
Japanese,"scene_evt190627_cp4_q2_s10,7428421",detail,루리아,あ、ビィさん。<br>サンダルなら艇の備品にありますよ。<br>確か浜辺用だった筈です。,"아, 비 씨. 샌들이라면 배에 비상용이 있어요. 아마 해변용이었을 거예요."
Japanese,"scene_evt190627_cp4_q2_s10,7428421",detail,비,ほんとか？<br>だったらそのビーサンを取って来て──,진짜야? 그럼 그 비상용을 가지고 와서...
Japanese,"scene_evt190627_cp4_q2_s10,7428421",detail,산달폰,ん……？<br>ビーサン……？,음...? 비상 용...?
Japanese,"scene_evt190627_cp4_q2_s10,7428421",detail,루리아,ビィさん……？,비상용...?
Japanese,"scene_evt190627_cp4_q2_s10,7428421",detail,비,あ、なんだよぅ！？,"뭐, 뭐야!?"
Japanese,"scene_evt190627_cp4_q2_s10,7428421",detail,산달폰,別に……<br>ついでにメロンも取って来て貰えるか。,아무 것도 아냐... 가는 김에 메론도 가져다 줬으면 좋겠군.
Japanese,"scene_evt190627_cp4_q2_s10,7428421",detail,산달폰,ビーサン？,비상 용 씨?
Japanese,"scene_evt190627_cp4_q2_s10,7428421",detail,비,こんにゃろお！<br>このサンダルサンダルサンダルぅ！,이 자식! 이 샌들샌들샌들 녀석!
Japanese,"scene_evt190627_cp4_q2_s10,7428421",detail,산달폰,む……<br>ビーサンビーサンビーサン。,윽... 비상 용 비상 용 비상 용.
Japanese,"scene_evt190627_cp4_q2_s10,7428421",detail,루리아,あはははは……<br>お店の前ですよふたりとも。,아하하... 우리 가게 앞이라는 거 잊지 마세요...
Japanese,"scene_evt190627_cp4_q2_s10,7428421",detail,상어 헌터,よぉ。<br>景気はどうだい？,어이. 장사 잘 돼?
Japanese,"scene_evt190627_cp4_q2_s10,7428421",detail,루리아,マーティンさん！<br>怪我は治ったんですか？,마틴 씨! 상처는 다 나으셨어요?
Japanese,"scene_evt190627_cp4_q2_s10,7428421",detail,상어 헌터,このとおりさ。<br>ぎりぎりサリエルが俺を引っ張ってよ。<br>アイツ見た目と違って怪力だぜ。,"보이는 대로야. 간신히 사리엘이 날 끌어내 줬지. 녀석, 겉보기와는 다르게 괴력이라니까."
Japanese,"scene_evt190627_cp4_q2_s10,7428421",detail,젊은 여성손님,でも本当に勇敢だわ。<br>浜辺はあなたの評判で持ちきりだもん！,정말 용감하네. 해변 전체에 당신 평판이 자자해!
Japanese,"scene_evt190627_cp4_q2_s10,7428421",detail,상어 헌터,ははは。<br>さぁ好きなものを頼んでいいぞ。<br>この屋台の奴等は俺の仲間でね。,"하하하. 자, 마음에 드는 걸로 골라. 이 노점 녀석들은 내 동료거든."
Japanese,"scene_evt190627_cp4_q2_s10,7428421",detail,젊은 여성손님,わぁい♪,와아!
Japanese,"scene_evt190627_cp4_q2_s10,7428421",detail,비,なぁなぁ……<br>ていうか学者の姉ちゃんはいないのか？<br>お前達ヨリが戻ったんだろ？,있지... 그 학자 누님은 어디 갔어? 너희 화해한 거 아니었어?
Japanese,"scene_evt190627_cp4_q2_s10,7428421",detail,상어 헌터,あ～……<br>まぁあのあと色々あったんだが……<br>ライフスタイルが合わねえというか……,아~ 뭐 그 뒤에 이런저런 일이 있었달까... 라이프스타일이 안 맞는달까...
Japanese,"scene_evt190627_cp4_q2_s10,7428421",detail,루리아,らいふすたいる？<br>また喧嘩ですか？,라이프... 스타일? 또 싸우신 거예요?
Japanese,"scene_evt190627_cp4_q2_s10,7428421",detail,비,わかんねぇなあ……<br>恋愛ってのはそんなに複雑なもんか？,이해가 안 가... 연애라는 건 그렇게 복잡한 거야?
Japanese,"scene_evt190627_cp4_q2_s10,7428421",detail,상어 헌터,複雑怪奇だよ。<br>特にインテリ女の頭ん中は理解できん。,복잡하고 기묘하지. 특히 고학력 여자 머리 속은 이해할 수가 없어.
Japanese,"scene_evt190627_cp4_q2_s10,7428421",detail,산달폰,極めてどうでもいいが、<br>注文する気はあるのか？,지극히 아무래도 상관없는 이야기군. 주문할 생각은 있나?
Japanese,"scene_evt190627_cp4_q2_s10,7428421",detail,사리엘,ブドウ……,포도...
Japanese,"scene_evt190627_cp4_q2_s10,7428421",detail,비,うわあ！<br>サリエルかよ……<br>お前いつの間にそこにいたんだ？,으악! 사리엘이잖아... 너 언제부터 거기 있었어?
Japanese,"scene_evt190627_cp4_q2_s10,7428421",detail,사리엘,ブドウ……,포도...
Japanese,"scene_evt190627_cp4_q2_s10,7428421",detail,루리아,ブドウジュースですか？<br>ありがとうございます！,포도 주스 말인가요? 감사합니다!
Japanese,"scene_evt190627_cp4_q2_s10,7428421",detail,사리엘,うぅん。<br>そのままそこにあるブドウがいいんだ。,아냐. 그대로 거기 있는 포도 줘.
Japanese,"scene_evt190627_cp4_q2_s10,7428421",detail,산달폰,…………？<br>君はフルーツが好きだったのか？,...? 넌 프루트를 좋아하는 건가?
Japanese,"scene_evt190627_cp4_q2_s10,7428421",detail,사리엘,ん……,응...
Japanese,"scene_evt190627_cp4_q2_s10,7428421",detail,상어 헌터,俺が出すよ。<br>借金完済を祝ってパァッと奢ってやる！,내가 내지. 빚 다 갚은 기념으로 팍팍 쏜다!
Japanese,"scene_evt190627_cp4_q2_s10,7428421",detail,사리엘,ありがとう。<br>ここにあるのでいい？,고마워. 여기 있는 거 가져가도 돼?
Japanese,"scene_evt190627_cp4_q2_s10,7428421",detail,상어 헌터,はぁ！？<br>アイツ箱ごと抱えて……<br>とんでもない量だぞ？,어억!? 저 녀석 상자째로 들고... 엄청난 양인데?
Japanese,"scene_evt190627_cp4_q2_s10,7428421",detail,루시오,…………,…………
Japanese,"scene_evt190627_cp4_q2_s10,7428421",detail,루시오,店長。<br>少々休憩を頂いても？<br>野暮用を思い出しました。,점장. 잠시 휴식해도 될까요? 사소한 용무가 생각났습니다.
Japanese,"scene_evt190627_cp4_q2_s10,7428421",detail,산달폰,わかった。<br>というか今日は協力を頼んでないが……,알았어. 그보다 오늘은 도와 달라고 부탁한 적 없다만...
Japanese,"scene_evt190627_cp4_q2_s10,7428421",detail,루시오,フフフ。<br>ありがとうございます──,후후후. 감사합니다.
Japanese,"scene_evt190627_cp4_q3_s10,7428431",synopsis,,市場のカフェテラスでは、ハールートとマールートが海洋学者の研究資料のまとめを手伝っていた。アズラエルはその近くで手作りのおはぎを売っていたが、そこにサリエルが現れる。大量のおはぎを受け取って去って行ったサリエルを不思議がるハールート。そこにサリエルを追ってルシオが現れるのだった。,"시장의 카페 테라스에서는, 하루트와 마루트가 해양학자의 연구자료 정리를 도와주고있었다. 아즈라엘은 그 근처에서 수제 떡을 팔고 있었지만, 거기에 사리엘이 나타난다. 대량의 떡을 받아 사라진 사리엘을 신기하게 생각하는 하루트. 거기에 사리엘을 쫓아온 루시오가 나타난 것이었다."
Japanese,"scene_evt190627_cp4_q3_s10,7428431",detail,,<span class='scene-font-katari'>市場のカフェのテラスにて、</span><br><span class='scene-font-katari'>エレンと双子達は資料をまとめていた。</span>,<span class='scene-font-katari'>시장의 카페테라스에서 엘렌과 쌍둥이는 자료를 정리하고 있었다.</span>
Japanese,"scene_evt190627_cp4_q3_s10,7428431",detail,,<span class='scene-font-katari'>というのも改めて商工会の面々に、</span><br><span class='scene-font-katari'>海洋生物の保護区を訴えるためだが……</span>,<span class='scene-font-katari'>그것은 다시 한번 상공회 사람들에게 해양생물 보호구 설립을 청원하기 위해서였는데...</span>
Japanese,"scene_evt190627_cp4_q3_s10,7428431",detail,해양학자,悪いわね。<br>本来の依頼はすでに終わってるのに。,미안해. 원래 의뢰는 이미 끝났는데.
Japanese,"scene_evt190627_cp4_q3_s10,7428431",detail,마루트,構わないわ。<br>乗りかかった船だもの。,괜찮아. 이미 한 배를 탄 몸인걸.
Japanese,"scene_evt190627_cp4_q3_s10,7428431",detail,하루트,僕達も気になってはいるんだ。<br>この件を人間がどう判断するのかね。,우리도 신경쓰이던 참이야. 이 일을 인간이 어떻게 판단할 것인지 말이지.
Japanese,"scene_evt190627_cp4_q3_s10,7428431",detail,해양학자,ありがとう。<br>そういえばアズちゃんはどこに……,고마워. 그러고 보니 아즈쨩은 어디에...
Japanese,"scene_evt190627_cp4_q3_s10,7428431",detail,아즈라엘,いらっさ～い♪<br>おはぎはいりませんか～？<br>あんこたっぷりですよ～？,어셔 오쩨요~ 팥떡 필요 없으세요? 팥 엄청 많이 들었어요~
Japanese,"scene_evt190627_cp4_q3_s10,7428431",detail,마루트,ウフフ♪<br>屋台の真似でおはぎを売ってるわ。<br>宿屋の台所で作ってたの。,우후후! 산달폰네 노점 흉내내면서 팥떡 팔고 있어. 숙소 부엌에서 만들었거든.
Japanese,"scene_evt190627_cp4_q3_s10,7428431",detail,해양학자,あらカワイイ！<br>お盆に乗せて街頭販売ね。<br>でも夏の観光地でおはぎは……,"어머, 귀여워라! 추석을 맞아서 길에서 파는 거구나. 하지만 여름 관광지에서 팥떡은 좀..."
Japanese,"scene_evt190627_cp4_q3_s10,7428431",detail,아즈라엘,きなこもありますよ～？<br>クルミもあるんですよ～？,인절미도 있어요~! 호두떡도 있어요~!
Japanese,"scene_evt190627_cp4_q3_s10,7428431",detail,루시오의 팬,ねえねえ！<br>あっちにタピオカジュースがあったよ。<br>ちょっと興味ない？,있잖아! 저기 버블티가 있대. 궁금하지 않아?
Japanese,"scene_evt190627_cp4_q3_s10,7428431",detail,<span class='scene-font-2'>루시오의 고참 팬</span>,目的はクレープだったのに？<br>ふたりでルシオ様に渡すって……<br>まぁでも確かに興味アリアリかも！,원래 목적은 크레이프 아니었어? 우리 둘이 사서 루시오 님께 드리기로 했잖아. 그치만 궁금하긴 하네!
Japanese,"scene_evt190627_cp4_q3_s10,7428431",detail,아즈라엘,あ、おはぎはいかが──,"아, 팥떡 어떠세..."
Japanese,"scene_evt190627_cp4_q3_s10,7428431",detail,하루트,苦戦中みたいだね……<br>でもがんばって作ったんだ。<br>ちょっと僕も行って来よう。,고전하는 모양이야. 하지만 열심히 만들었어. 나도 잠깐 가 봐야지.
Japanese,"scene_evt190627_cp4_q3_s10,7428431",detail,마루트,おねがいね。<br>エレンは資料まとまりそう？<br>プレゼンテーションをするのよね。,잘 부탁해. 엘렌은 자료 정리 끝나가? 프레젠테이션도 한다고 했었지.
Japanese,"scene_evt190627_cp4_q3_s10,7428431",detail,해양학자,問題ないわ。<br>後は現場の……<br>サメハンターの意見も載せたいけど……,잘 되고 있어. 이제 현장... 상어 헌터의 의견도 적고 싶은데...
Japanese,"scene_evt190627_cp4_q3_s10,7428431",detail,마루트,マーティンは？,마틴은?
Japanese,"scene_evt190627_cp4_q3_s10,7428431",detail,해양학자,嫌よ。,싫어.
Japanese,"scene_evt190627_cp4_q3_s10,7428431",detail,마루트,断固たる拒否……<br>まだ喧嘩中なの？,단호한 거절...! 또 싸운 거야?
Japanese,"scene_evt190627_cp4_q3_s10,7428431",detail,해양학자,だって聞いてよ。<br>浜辺の英雄だとか評判になったせいで、<br>若い女性が寄って来るようになってね。,좀 들어보라니까. 해변의 영웅이니 뭐니 유명해진 탓에 젊은 여자가 잔뜩 몰려들게 됐어.
Japanese,"scene_evt190627_cp4_q3_s10,7428431",detail,해양학자,約束にも遅刻、遅刻、遅刻……<br>英雄と会えて光栄だろうって態度なの。<br>私もファンのひとりみたいに扱うのよ？,"약속에도 계속 지각, 지각, 지각... 만나도 영웅과 만나서 영광이지? 하는 태도라니까. 나도 팬 중 한 명처럼 다룬다고. "
Japanese,"scene_evt190627_cp4_q3_s10,7428431",detail,해양학자,ほんっとクズ。<br>だいたいブルースの件は皆の力なのに。,진짜 쓰레기야. 애초에 브루스 건은 다 함께 해낸 일인데.
Japanese,"scene_evt190627_cp4_q3_s10,7428431",detail,마루트,あらあら……<br>駄目な男ねえ。,어머어머... 몹쓸 남자네.
Japanese,"scene_evt190627_cp4_q3_s10,7428431",detail,마루트,でも彼にとってブルースは、<br>何年も追ってきた敵なのよね。<br>ちょっと調子に乗るのもわかるかも？,그치만 그에게 있어 브루스는 몇 년이나 쫓아 온 적이었잖아. 조금 우쭐해지는 기분도 이해되긴 해.
Japanese,"scene_evt190627_cp4_q3_s10,7428431",detail,해양학자,そこはまぁ……<br>知り合った頃にはすでに追ってたわ。,그건 뭐... 내가 만났을 때에는 이미 브루스를 쫓는 중이었어.
Japanese,"scene_evt190627_cp4_q3_s10,7428431",detail,해양학자,とても熱心に作戦を立てて、<br>浜辺の人々を守る情熱を語っててね。,"굉장히 열심히 작전도 짜고, 해변 사람들을 지키겠다고 열정적으로 떠들었었지."
Japanese,"scene_evt190627_cp4_q3_s10,7428431",detail,해양학자,でも今は彼の努力の過程も知らず、<br>お祭気分で持て囃す人達に乗せられて。,하지만 지금은 그 노력해온 과정도 모르고 그저 흥미위주로 몰려드는 사람한테 둘러싸였지.
Japanese,"scene_evt190627_cp4_q3_s10,7428431",detail,해양학자,あんなの見てらんないわ……<br>誰が本当に自分を讃えてると……,그런 건 봐 줄 수가 없어. 누가 자기를 진짜로 칭찬해주는 사람인지도 모르고...
Japanese,"scene_evt190627_cp4_q3_s10,7428431",detail,마루트,ふぅん？<br>あなたこそが最も彼を讃えてる？,흐음? 당신이야말로 그 사람이라는 거야?
Japanese,"scene_evt190627_cp4_q3_s10,7428431",detail,해양학자,あ……<br>そこまで主張する気はないけど……,아... 그렇게까지 얘기할 생각은 없어...
Japanese,"scene_evt190627_cp4_q3_s10,7428431",detail,마루트,うんうん♪<br>後で一緒にマーティンの話を聞こっか。<br>プレゼン資料のためにね。,응응! 나중에 같이 마틴 얘기도 들어 보자. 프레젠테이션 자료도 모을 겸.
Japanese,"scene_evt190627_cp4_q3_s10,7428431",detail,해양학자,でも……,하지만...
Japanese,"scene_evt190627_cp4_q3_s10,7428431",detail,마루트,ウフフ♪,우후후!
Japanese,"scene_evt190627_cp4_q3_s10,7428431",detail,하루트,…………？<br>君はおはぎが好きだったのかい？,...? 너 팥떡 좋아했어?
Japanese,"scene_evt190627_cp4_q3_s10,7428431",detail,사리엘,ん……,응...
Japanese,"scene_evt190627_cp4_q3_s10,7428431",detail,아즈라엘,ブドウいっぱい持ってるねえ。<br>アズのおはぎも箱に詰めるの？,"포도, 엄청 많이 들고 있네. 아즈네 팥떡 들어갈 자리는 있어?"
Japanese,"scene_evt190627_cp4_q3_s10,7428431",detail,사리엘,うん。<br>おはぎもいっぱい必要なんだ。,응. 팥떡도 많이 필요해.
Japanese,"scene_evt190627_cp4_q3_s10,7428431",detail,사리엘,……たぶん。,...아마도.
Japanese,"scene_evt190627_cp4_q3_s10,7428431",detail,하루트,よいせっと。<br>落ちないように詰めといたよ。<br>でも何をする気なんだ？,영차. 안 떨어지게 잘 넣었어. 그런데 뭘 하려고 그래?
Japanese,"scene_evt190627_cp4_q3_s10,7428431",detail,사리엘,…………,…………
Japanese,"scene_evt190627_cp4_q3_s10,7428431",detail,사리엘,ありがとう……,고마워...
Japanese,"scene_evt190627_cp4_q3_s10,7428431",detail,아즈라엘,サリたん……？<br>急いで行っちゃったねえ。,사리...? 급하게 가 버렸어.
Japanese,"scene_evt190627_cp4_q3_s10,7428431",detail,하루트,あ、代金！<br>ちょっと待ってサリエル──,"아, 돈! 잠깐 기다려 사리ㅇ..."
Japanese,"scene_evt190627_cp4_q3_s10,7428431",detail,루시오,私が立て替えておきますよ。,제가 대신 내 드리죠.
Japanese,"scene_evt190627_cp4_q3_s10,7428431",detail,아즈라엘,あ、うんちょ。,"아, 응가."
Japanese,"scene_evt190627_cp4_q3_s10,7428431",detail,하루트,<span class='scene-font-2'>コ、コラ！</span><br><span class='scene-font-2'>さすがに失礼だよ。</span>,"<span class='scene-font-2'>야, 얌마! 그러면 실례잖아.</span>"
Japanese,"scene_evt190627_cp4_q3_s10,7428431",detail,루시오,フフフ。<br>こんにちは、うんちょです。<br>ついでに私も何か頂いても？,"후후후. 안녕하세요, 응가입니다. 돈 내는 김에 저도 하나 먹을 수 있을까요?"
Japanese,"scene_evt190627_cp4_q3_s10,7428431",detail,아즈라엘,ありがと～♪<br>今日はクルミがいい出来だよお！,고마워~ 오늘은 호두 들은 게 잘 만들어졌어!
Japanese,"scene_evt190627_cp4_q3_s10,7428431",detail,루시오,素敵ですね。<br>ありがとうございます──,정말 멋지네요. 감사합니다.
