Language,SceneCode,Type,Name,Origin,Korean
Japanese,"scene_evt200628_cp5_q4_s10,7556541",synopsis,,コルルは甲板に向かう途中、図らずもレッドラックの本音を聞いてしまう。そこで突然アーミラに声をかけられ甲板に飛び出たコルルは、レッドラックに本音を聞いてしまったことを正直に打ち明け、改めて優勝への想いを強くする。コルルの熱意に感化されたか、アーミラも優勝への意気込みを見せ、ふたりは譲れない覚悟を胸に秘めて翌日の決勝戦に臨むのだった。,"코루루는 갑판으로 향하던 도중 우연히 레드락의 본심을 들어버린다. 거기서 아미라가 갑자기 말을 걸어 갑판으로 튀어나온 코루루는 레드락의 본심을 들었다는 것을 정직하게 고백하고, 다시한번 우승에 대한 각오를 강하게 다진다. 코루루의 열정에 감화되었는지, 아미라도 우승에 대한 의지를 보여, 둘은 양보할 수 없는 각오를 가슴에 품고 내일 있을 결승전에 임하는 것이었다."
Japanese,"scene_evt200628_cp5_q4_s10,7556541",detail,코루루,…………,…………
Japanese,"scene_evt200628_cp5_q4_s10,7556541",detail,,<span class='scene-font-katari'>甲板に続く扉の陰から、</span><br><span class='scene-font-katari'>コルルは図らずも</span><br><span class='scene-font-katari'>レッドラックの本音を聞いていた。</span>,"<span class='scene-font-katari'>갑판으로 이어지는 문틈에서, 코루루는 의도치 않게 레드락의 속마음을 듣고 있었다.</span>"
Japanese,"scene_evt200628_cp5_q4_s10,7556541",detail,코루루,師匠……<br>それほど優勝を夢見て……,스승님... 그렇게 우승을 꿈꾸고 있었다니...
Japanese,"scene_evt200628_cp5_q4_s10,7556541",detail,코루루,やはりわたしは……<br>取り返しのつかないことを……,역시 난 돌이킬 수 없는 짓을 저질렀소이다...
Japanese,"scene_evt200628_cp5_q4_s10,7556541",detail,아미라,どうした？,왜 그래?
Japanese,"scene_evt200628_cp5_q4_s10,7556541",detail,코루루,<span class='scene-font-4'>ほえっ！？</span>,<span class='scene-font-4'>으아!</span>
Japanese,"scene_evt200628_cp5_q4_s10,7556541",detail,,<span class='scene-font-katari'>突然背後から声をかけられ、</span><br><span class='scene-font-katari'>コルルは驚きの余り</span><br><span class='scene-font-katari'>飛び跳ねるように甲板に転び出る。</span>,"<span class='scene-font-katari'>갑자기 등 뒤에서 들린 목소리에 깜짝 놀란 나머지, 코루루는 튀어나가듯 갑판에 굴러떨어졌다.</span>"
Japanese,"scene_evt200628_cp5_q4_s10,7556541",detail,코루루,いたたた……,아야야야...
Japanese,"scene_evt200628_cp5_q4_s10,7556541",detail,아미라,大丈夫？,괜찮아?
Japanese,"scene_evt200628_cp5_q4_s10,7556541",detail,코루루,し、心配には及び申さん……,"거, 걱정할 거 없소이다..."
Japanese,"scene_evt200628_cp5_q4_s10,7556541",detail,,<span class='scene-font-katari'>コルルはアーミラの手を取って</span><br><span class='scene-font-katari'>立ち上がると、月の光を遮りながら</span><br><span class='scene-font-katari'>巨体が近付いてくる。</span>,"<span class='scene-font-katari'>코루루가 아미라의 손을 잡고 일어서자, 달빛을 가리며 거대한 그림자가 다가왔다.</span>"
Japanese,"scene_evt200628_cp5_q4_s10,7556541",detail,레드락,嬢ちゃん達……聞いてたのか。,아가씨들... 듣고 있었어?
Japanese,"scene_evt200628_cp5_q4_s10,7556541",detail,코루루,あ、いんやぁ……<br>そのぉ……,"아, 아니... 그게..."
Japanese,"scene_evt200628_cp5_q4_s10,7556541",detail,코루루,緊張で寝付けずにいたら、皆さんの<br>賑やかな声が聞こえ申して……,"긴장 때문에 잠들지 못하던 참에, 여러분이 신나게 이야기하는 목소리가 들렸소이다..."
Japanese,"scene_evt200628_cp5_q4_s10,7556541",detail,아미라,なんの話？,무슨 이야기?
Japanese,"scene_evt200628_cp5_q4_s10,7556541",detail,비이,おっさんの気持ちのあれこれだよ。<br>聞いてたんだろ？,아저씨의 이런저런 마음에 대한 이야기. 듣고 있지 않았어?
Japanese,"scene_evt200628_cp5_q4_s10,7556541",detail,아미라,ううん。<br>私はおやつを探していた。,아니. 난 간식 찾고 있었어.
Japanese,"scene_evt200628_cp5_q4_s10,7556541",detail,레드락,…………,…………
Japanese,"scene_evt200628_cp5_q4_s10,7556541",detail,레드락,嬢ちゃんに余計なもんを<br>背負わせちまうと思ったから、<br>聞かせたくなかったんだがな……,...... 아가씨한테 괜한 짐을 씌우는 것 같아서 들려주고 싶지 않았다만...
Japanese,"scene_evt200628_cp5_q4_s10,7556541",detail,코루루,…………,…………
Japanese,"scene_evt200628_cp5_q4_s10,7556541",detail,레드락,もう隠す意味もねぇから、<br>正面切って言っちまうか。,이제 숨겨봤자 의미도 없으니 대놓고 말해버려야겠군.
Japanese,"scene_evt200628_cp5_q4_s10,7556541",detail,레드락,俺がショックだったのは確かだ。<br>あん時ぁさすがに俺も心が挫けかけた。,내가 쇼크를 받은 건 사실이야. 그때는 아무리 나라도 마음이 꺾일 뻔했지. 
Japanese,"scene_evt200628_cp5_q4_s10,7556541",detail,레드락,俺の中の炎みてぇな熱い何かが<br>一気に萎んじまって、<br>目の前が真っ暗になりかけた。,내 마음 속의 불꽃같이 뜨거운 뭔가가 순식간에 시들어서 눈 앞이 시커매지더라고.
Japanese,"scene_evt200628_cp5_q4_s10,7556541",detail,레드락,だが、嬢ちゃんの熱意が、<br>俺の心に再び火を灯してくれたのさ。<br>まだ夢を諦めるには早ぇぞ、ってな。,하지만 아가씨의 열의가 내 마음에 다시 불꽃을 피워줬어. 아직 꿈을 포기하기엔 이르다고 말야.
Japanese,"scene_evt200628_cp5_q4_s10,7556541",detail,레드락,だからよ……<br>俺にもう一度、夢を見させてくれ。,그러니까... 다시 한 번 내게 꿈을 보게 해 줘.
Japanese,"scene_evt200628_cp5_q4_s10,7556541",detail,레드락,優勝した姿を俺に見せてくれ。<br>頼むぜ、コルル。,"우승한 모습을 내게 보여달라고. 부탁한다, 코루루."
Japanese,"scene_evt200628_cp5_q4_s10,7556541",detail,코루루,師匠……,스승님...
Japanese,"scene_evt200628_cp5_q4_s10,7556541",detail,코루루,……わかり申した！<br>もう迷いは致さん！,알겠소이다. 더 이상 망설이지 않겠소이다!
Japanese,"scene_evt200628_cp5_q4_s10,7556541",detail,코루루,全身全霊を懸け、<br>優勝を目指すでごんす！,온 힘을 다 바쳐서 우승을 노리리다!
Japanese,"scene_evt200628_cp5_q4_s10,7556541",detail,레드락,おう！ その意気だ！,그래! 그 마음가짐이야!
Japanese,"scene_evt200628_cp5_q4_s10,7556541",detail,아미라,優勝……,우승...
Japanese,"scene_evt200628_cp5_q4_s10,7556541",detail,코루루,もちろんでごんす！<br>アーミラが相手でも、<br>優勝だけは譲れないで申す！,물론이외다! 아미라 씨가 상대라도 우승만은 양보할 수 없소이다!
Japanese,"scene_evt200628_cp5_q4_s10,7556541",detail,아미라,……私は負けない。,...나는 안 져.
Japanese,"scene_evt200628_cp5_q4_s10,7556541",detail,아미라,お母さんに……私の評判を届ける。,엄마한테 내 소문을 들려줄 거야.
Japanese,"scene_evt200628_cp5_q4_s10,7556541",detail,코루루,アーミラ……,아미라...
Japanese,"scene_evt200628_cp5_q4_s10,7556541",detail,,<span class='scene-font-katari'>アーミラは静かにそう言い残し、</span><br><span class='scene-font-katari'>踵を返して艇の中に戻っていく。</span>,<span class='scene-font-katari'>아미라는 조용히 그 말만을 남긴 후 발길을 돌려 배 안으로 돌아갔다.</span>
Japanese,"scene_evt200628_cp5_q4_s10,7556541",detail,코루루,譲れない気持ちは同じ……,양보할 수 없는 마음은 마찬가지...
Japanese,"scene_evt200628_cp5_q4_s10,7556541",detail,코루루,それでも……<br><span class='scene-font-4'>わたしが必ず勝つでごんす！</span>,그렇다고 해도 <br><span class='scene-font-4'>내가 반드시 이길 것이외다!</span>
Japanese,"scene_evt200628_cp5_q4_s10,7556541",detail,,<span class='scene-font-katari'>相対し、互いに負けられない理由を</span><br><span class='scene-font-katari'>ぶつけ合ったコルルとアーミラ。</span>,<span class='scene-font-katari'>코루루와 아미라의 질 수 없는 이유가 서로 맞붙었다.</span>
Japanese,"scene_evt200628_cp5_q4_s10,7556541",detail,,<span class='scene-font-katari'>それぞれの覚悟を胸に秘め、</span><br><span class='scene-font-katari'>ふたりは翌日の決勝に臨むのだった。</span>,"<span class='scene-font-katari'>각자의 각오를 가슴 속에 품은 채, 두 사람은 다음 날의 결승에 임했다.</span>"

English,"scene_evt200628_cp5_q1_s10,7556511",synopsis,,"Redluck warns Kolulu and Amira that they currently stand no chance against Mash. However, he says he can teach them eating techniques to give them a fighting chance. He gives them an example of a technique he did for a round: eating vegetables to provide a cushion for more food in his stomach. With a bit of enthusiastic encouragement, Redluck takes them away for training."
English,"scene_evt200628_cp5_q1_s10,7556511",detail,,Redluck decides to train Kolulu and Amira to be better competitive eaters.
English,"scene_evt200628_cp5_q1_s10,7556511",detail,,"But before training can start, he gives them a stern warning."
English,"scene_evt200628_cp5_q1_s10,7556511",detail,Redluck,Don't think this is going to magically give you the win.
English,"scene_evt200628_cp5_q1_s10,7556511",detail,Redluck,Especially considering that neither of you stands a chance against Mash as you both are.
English,"scene_evt200628_cp5_q1_s10,7556511",detail,Redluck,"By the way, how much effort did you put into today's elimination round? Ate so much you feel like bursting?"
English,"scene_evt200628_cp5_q1_s10,7556511",detail,Kolulu,"Yes, I gave it my all!"
English,"scene_evt200628_cp5_q1_s10,7556511",detail,Amira,"I'm full, but I want to eat again!"
English,"scene_evt200628_cp5_q1_s10,7556511",detail,Redluck,Figured as much. That's no good.
English,"scene_evt200628_cp5_q1_s10,7556511",detail,Kolulu,It isn't? Why?
English,"scene_evt200628_cp5_q1_s10,7556511",detail,Redluck,Not saying that you shouldn't give it your all when you compete. But you gotta pace yourself before reaching the end goal.
English,"scene_evt200628_cp5_q1_s10,7556511",detail,Redluck,Like climbing a mountain. Have either of you hiked up one before?
English,"scene_evt200628_cp5_q1_s10,7556511",detail,Kolulu,"I've never done it, no."
English,"scene_evt200628_cp5_q1_s10,7556511",detail,Amira,Nope.
English,"scene_evt200628_cp5_q1_s10,7556511",detail,Redluck,I've had my fair share of experience from pilgrimages. Had to go up huge slopes sometimes.
English,"scene_evt200628_cp5_q1_s10,7556511",detail,Redluck,"Took me days to get to the top of those, but the most important part wasn't getting up. It was coming down."
English,"scene_evt200628_cp5_q1_s10,7556511",detail,Redluck,"Saw too many people who spent all their energy going up, hurt themselves on the way, and died at the top."
English,"scene_evt200628_cp5_q1_s10,7556511",detail,Redluck,They forgot the end goal wasn't making it up. It was getting back to the foot of the mountain and making it out alive.
English,"scene_evt200628_cp5_q1_s10,7556511",detail,Redluck,"The end goal for this competition is victory, obviously."
English,"scene_evt200628_cp5_q1_s10,7556511",detail,Redluck,Giving everything you've got for the elimination round means you can't go all out for the final round.
English,"scene_evt200628_cp5_q1_s10,7556511",detail,Kolulu,"But if I lost before making it to the finals, what would be the point of conserving my energy?"
English,"scene_evt200628_cp5_q1_s10,7556511",detail,Redluck,"Good question. That's what makes competitive eating hard, you see."
English,"scene_evt200628_cp5_q1_s10,7556511",detail,Redluck,But us pros know how to go hard without pushing past our limits.
English,"scene_evt200628_cp5_q1_s10,7556511",detail,Kolulu,Without... pushing past our limits?
English,"scene_evt200628_cp5_q1_s10,7556511",detail,Redluck,Gahaha! It's a hard concept to really grasp.
English,"scene_evt200628_cp5_q1_s10,7556511",detail,Redluck,"To put it simply, you have to know where your limit is, keep that in mind, and watch that you don't cross that line. I guess that didn't clear it up either, huh?"
English,"scene_evt200628_cp5_q1_s10,7556511",detail,Redluck,The point I'm trying to make is that Mash hasn't come close to his limit yet.
English,"scene_evt200628_cp5_q1_s10,7556511",detail,Redluck,"You saw how much he ate today, yeah? He can eat ten times more than the both of you combined."
English,"scene_evt200628_cp5_q1_s10,7556511",detail,Redluck,"The fact that he can still eat even more, but you two already hit your limits... Do you get what I'm hinting at?"
English,"scene_evt200628_cp5_q1_s10,7556511",detail,Kolulu & Amira,...
English,"scene_evt200628_cp5_q1_s10,7556511",detail,Redluck,"He's hotheaded and never knows when to shut his mouth, but he still competes with the knowledge and skill of a pro."
English,"scene_evt200628_cp5_q1_s10,7556511",detail,Redluck,"Competitive eating comes down to that: using your head, not your stomach."
English,"scene_evt200628_cp5_q1_s10,7556511",detail,Redluck,That's my first lesson for you.
English,"scene_evt200628_cp5_q1_s10,7556511",detail,Kolulu,Using my head...
English,"scene_evt200628_cp5_q1_s10,7556511",detail,Amira,Using... my head?
English,"scene_evt200628_cp5_q1_s10,7556511",detail,Redluck,"Probably not your strong suits, judging by your reactions."
English,"scene_evt200628_cp5_q1_s10,7556511",detail,Redluck,Let me give you an example then.
English,"scene_evt200628_cp5_q1_s10,7556511",detail,Redluck,I used a technique right before my turn in the afternoon bracket today.
English,"scene_evt200628_cp5_q1_s10,7556511",detail,Redluck,Did it right in front of you two. Remember?
English,"scene_evt200628_cp5_q1_s10,7556511",detail,,"Kolulu and Amira think for a moment, then shake their heads."
English,"scene_evt200628_cp5_q1_s10,7556511",detail,Redluck,"Okay, here's a hint. What was I doing in the break area?"
English,"scene_evt200628_cp5_q1_s10,7556511",detail,Kolulu,Oh!
English,"scene_evt200628_cp5_q1_s10,7556511",detail,Redluck,"Munch, munch, chew..."
English,"scene_evt200628_cp5_q1_s10,7556511",detail,Redluck,"Part of the competition, of course."
English,"scene_evt200628_cp5_q1_s10,7556511",detail,Kolulu,You were eating vegetables.
English,"scene_evt200628_cp5_q1_s10,7556511",detail,Redluck,Bingo.
English,"scene_evt200628_cp5_q1_s10,7556511",detail,Redluck,The vegetables act as a cushion in your stomach if you eat them beforehand.
English,"scene_evt200628_cp5_q1_s10,7556511",detail,Redluck,Helps relieve the feeling of the food weighing you down. That's just one technique though.
English,"scene_evt200628_cp5_q1_s10,7556511",detail,Redluck,I can tell talking about it isn't really giving you a concrete idea though. How about a more familiar example?
English,"scene_evt200628_cp5_q1_s10,7556511",detail,,Redluck gives Kolulu a pointed look.
English,"scene_evt200628_cp5_q1_s10,7556511",detail,Redluck,You used a technique earlier.
English,"scene_evt200628_cp5_q1_s10,7556511",detail,Kolulu,I did?
English,"scene_evt200628_cp5_q1_s10,7556511",detail,Redluck,"When that jellato gave you a headache, you did something to combat the pain, yeah?"
English,"scene_evt200628_cp5_q1_s10,7556511",detail,Kolulu,"Oh, um... I held my breath and focused really hard..."
English,"scene_evt200628_cp5_q1_s10,7556511",detail,Redluck,That's what I'm talking about.
English,"scene_evt200628_cp5_q1_s10,7556511",detail,Kolulu,Huh?
English,"scene_evt200628_cp5_q1_s10,7556511",detail,Redluck,That pain you felt is what we call a brain freeze. Always happens when you eat a ton of cold food at once.
English,"scene_evt200628_cp5_q1_s10,7556511",detail,Redluck,"Leaving aside the specifics of why it happens, there are other ways to deal with brain freezes."
English,"scene_evt200628_cp5_q1_s10,7556511",detail,Redluck,"One way is to put something cold against where it hurts, then press your tongue to the roof of your mouth. It'll warm up your nerves."
English,"scene_evt200628_cp5_q1_s10,7556511",detail,Redluck,"The idea is to warm your mouth back up, which is what you did by accident."
English,"scene_evt200628_cp5_q1_s10,7556511",detail,Kolulu,"I was so focused on trying to keep going that I didn't even notice... Hmmm, mortal bodies are strange indeed!"
English,"scene_evt200628_cp5_q1_s10,7556511",detail,Redluck,"Still, being able to focus through the pain at all is an impressive feat."
English,"scene_evt200628_cp5_q1_s10,7556511",detail,Redluck,That hardy physique of yours and the resilience from your upbringing combined with a little luck saved you there.
English,"scene_evt200628_cp5_q1_s10,7556511",detail,Redluck,"And while it was luck that got you through it, I can see the potential you have as well."
English,"scene_evt200628_cp5_q1_s10,7556511",detail,Redluck,"Do you see my point though? One technique can make or break your chances. Pretty crazy, huh?"
English,"scene_evt200628_cp5_q1_s10,7556511",detail,Kolulu,"With the right technique, victory is possible. Am I correct to assume that?"
English,"scene_evt200628_cp5_q1_s10,7556511",detail,Redluck,"Yeah, that's right."
English,"scene_evt200628_cp5_q1_s10,7556511",detail,,"Clenching her fists determinedly, Kolulu holds Redluck's gaze."
English,"scene_evt200628_cp5_q1_s10,7556511",detail,Kolulu,"Then please, teach me everything you know!"
English,"scene_evt200628_cp5_q1_s10,7556511",detail,Redluck,You got it!
English,"scene_evt200628_cp5_q1_s10,7556511",detail,Redluck,"You two are unpolished as they come, being complete beginners and whatnot."
English,"scene_evt200628_cp5_q1_s10,7556511",detail,Redluck,"But that just means you have that much room to improve. We've only got a day to get you both ready, but we're going to make every second count."
English,"scene_evt200628_cp5_q1_s10,7556511",detail,Redluck,"Kids... No, Kolulu, Amira!"
English,"scene_evt200628_cp5_q1_s10,7556511",detail,Redluck,Training starts now! Follow me!
English,"scene_evt200628_cp5_q1_s10,7556511",detail,Kolulu & Amira,"Sir, yes, sir!"
English,"scene_evt200628_cp5_q1_s10,7556511",detail,,"With a fire lit beneath them, Kolulu and Amira trail after Redluck."
English,"scene_evt200628_cp5_q2_s10,7556521",synopsis,,"As the crew works on the finishing touches for dinner, Redluck and Kolulu return from training. Amira arrives a little later, having been released from training earlier when Redluck realized that he couldn't help her. She is exhausted for unexplained reasons, and the crew has to carry her to bed. After the main course for dinner is eaten, Lucio joins the crew in time for dessert."
English,"scene_evt200628_cp5_q2_s10,7556521",detail,,The sun sets some hours after Redluck's coaching begins.
English,"scene_evt200628_cp5_q2_s10,7556521",detail,,The rest of the crew is preparing dinner when the trainee and trainer return.
English,"scene_evt200628_cp5_q2_s10,7556521",detail,Kolulu,Something smells great!
English,"scene_evt200628_cp5_q2_s10,7556521",detail,Redluck,"Great timing, eh? I'm starving after all that work."
English,"scene_evt200628_cp5_q2_s10,7556521",detail,Sevastien,"If you could please wait a little longer, the final touches on dinner will be complete."
English,"scene_evt200628_cp5_q2_s10,7556521",detail,Vyrn,"Heya, guys! How'd the crash course go?"
English,"scene_evt200628_cp5_q2_s10,7556521",detail,Kolulu,I accomplished as much as I could!
English,"scene_evt200628_cp5_q2_s10,7556521",detail,Kolulu,"Thanks to Master's help, I'm leaps and bounds more prepared than before!"
English,"scene_evt200628_cp5_q2_s10,7556521",detail,Vyrn,Master?
English,"scene_evt200628_cp5_q2_s10,7556521",detail,Redluck,"Embarrassing, I know. I told her to quit it, but she just wouldn't listen."
English,"scene_evt200628_cp5_q2_s10,7556521",detail,Kolulu,"Master is Master, and that's that!"
English,"scene_evt200628_cp5_q2_s10,7556521",detail,Redluck,Head's harder than a rock in both senses.
English,"scene_evt200628_cp5_q2_s10,7556521",detail,Vyrn,"Haha, you two are getting along like a house on fire!"
English,"scene_evt200628_cp5_q2_s10,7556521",detail,Vyrn,So what kinda training did you get up to? Musta taught her some crazy stuff if she's looking this confident.
English,"scene_evt200628_cp5_q2_s10,7556521",detail,Redluck,You'll just have to wait and see tomorrow.
English,"scene_evt200628_cp5_q2_s10,7556521",detail,Kolulu,Hehe... That's right!
English,"scene_evt200628_cp5_q2_s10,7556521",detail,Vyrn,"Now I'm really dying to know, but I guess I'll see. Can't wait!"
English,"scene_evt200628_cp5_q2_s10,7556521",detail,Vyrn,Same goes for Amira...
English,"scene_evt200628_cp5_q2_s10,7556521",detail,Vyrn,"Hold up, where is she?"
English,"scene_evt200628_cp5_q2_s10,7556521",detail,Redluck,"Ah, she's..."
English,"scene_evt200628_cp5_q2_s10,7556521",detail,,"Redluck hesitates to finish his sentence, stroking his beard awkwardly."
English,"scene_evt200628_cp5_q2_s10,7556521",sel1_txt,,Did something happen to her?
English,"scene_evt200628_cp5_q2_s10,7556521",sel2_txt,,Was there an accident?
English,"scene_evt200628_cp5_q2_s10,7556521",detail,Vyrn,"She didn't get seriously hurt while learning, right?"
English,"scene_evt200628_cp5_q2_s10,7556521",detail,Lyria,An accident? Like... drowning or something?
English,"scene_evt200628_cp5_q2_s10,7556521",detail,Redluck,"Whoa, whoa, there's been a misunderstanding here."
English,"scene_evt200628_cp5_q2_s10,7556521",detail,Redluck,We didn't do anything dangerous. Just covered some knowledge and a bit of practical implementation.
English,"scene_evt200628_cp5_q2_s10,7556521",detail,Redluck,"Anyway, I took Amira out of the training."
English,"scene_evt200628_cp5_q2_s10,7556521",detail,Vyrn,Say what? Did she throw a fit or something?
English,"scene_evt200628_cp5_q2_s10,7556521",detail,Redluck,"Nah, nothing like that. Realized training wasn't for her, simple as that."
English,"scene_evt200628_cp5_q2_s10,7556521",detail,Redluck,"She tried to follow along with Kolulu at the start, but she was having a hard time using her noggin."
English,"scene_evt200628_cp5_q2_s10,7556521",detail,Redluck,"Figured she's more the type to live by her instincts, and trying to mess with that was only going to confuse her and make things worse."
English,"scene_evt200628_cp5_q2_s10,7556521",detail,Redluck,So we let her leave to do her own thing after a bit.
English,"scene_evt200628_cp5_q2_s10,7556521",detail,Redluck,"I was the one who gave up on her, as much as it pains me to admit."
English,"scene_evt200628_cp5_q2_s10,7556521",detail,Redluck,I don't know enough to be able to teach her.
English,"scene_evt200628_cp5_q2_s10,7556521",detail,Vyrn,"That explains the glum, guilty face."
English,"scene_evt200628_cp5_q2_s10,7556521",detail,Lyria,But thank you for explaining to us. I'm just glad nothing serious happened.
English,"scene_evt200628_cp5_q2_s10,7556521",detail,Vyrn,"Same here. And big guy? You don't give yourself enough credit. If you can't teach her, I don't think anybody can, so chin up!"
English,"scene_evt200628_cp5_q2_s10,7556521",detail,Redluck,"Hahaha, you think so? Have to admit, takes a weight off my shoulders to hear it."
English,"scene_evt200628_cp5_q2_s10,7556521",detail,Vyrn,Would be nice to know where Amira wandered off to though. It's almost time to eat.
English,"scene_evt200628_cp5_q2_s10,7556521",detail,Redluck,I did tell her to come home before it got dark.
English,"scene_evt200628_cp5_q2_s10,7556521",detail,Amira,Yawn... I'm back...
English,"scene_evt200628_cp5_q2_s10,7556521",detail,Vyrn,"Well, that's some timing."
English,"scene_evt200628_cp5_q2_s10,7556521",detail,Vyrn,You're pretty late. What were you up to out there?
English,"scene_evt200628_cp5_q2_s10,7556521",detail,Amira,Mmm... Yawn...
English,"scene_evt200628_cp5_q2_s10,7556521",detail,Vyrn,"Sheesh, you look ready to drop dead on your feet."
English,"scene_evt200628_cp5_q2_s10,7556521",detail,Vyrn,"Guess as long as you're back safe and sound, that's what matters most. C'mon, go wash your hands. Dinner's almost ready."
English,"scene_evt200628_cp5_q2_s10,7556521",detail,Amira,Dinner... Yay...
English,"scene_evt200628_cp5_q2_s10,7556521",detail,Lyria,"Oh my gosh, Amira!"
English,"scene_evt200628_cp5_q2_s10,7556521",detail,Vyrn,Are you okay? Did you hit your head or something?
English,"scene_evt200628_cp5_q2_s10,7556521",detail,Sevastien,The peculiar smell and shell fragments around her lips appear to be the remnants of oysters.
English,"scene_evt200628_cp5_q2_s10,7556521",detail,Sevastien,Which means she most likely discovered a reef rich with them and gorged herself.
English,"scene_evt200628_cp5_q2_s10,7556521",detail,Amira,I'm so full... It was so fun...
English,"scene_evt200628_cp5_q2_s10,7556521",detail,Lyria,"Haha, she looks incredibly happy."
English,"scene_evt200628_cp5_q2_s10,7556521",detail,Vyrn,Huh... What's so fun about eating oysters?
English,"scene_evt200628_cp5_q2_s10,7556521",detail,Amira,Gargle... Mmmm... Zzz...
English,"scene_evt200628_cp5_q2_s10,7556521",detail,Vyrn,And she's out.
