Language,SceneCode,Type,Name,Origin,Korean
English,"scene_evt190627_cp4_q4_s10,7428441",detail,Sandalphon,It would be difficult for me to care less... But you should make a decision before it rains.
English,"scene_evt190627_cp4_q4_s10,7428441",detail,Sandalphon,"Bear in mind that while you struggle with your emotions, she may move on, and then it will be too late."
English,"scene_evt190627_cp4_q4_s10,7428441",detail,Sandalphon,Someday... those words need to be said... 'I didn't realize until you were gone how much I took you for granted.'
English,"scene_evt190627_cp4_q4_s10,7428441",detail,Shark Hunter,You...
English,"scene_evt190627_cp4_q4_s10,7428441",detail,Shark Hunter,Whoa! The wind's out of control... Looks like there's a big rain cloud rolling in from the sea.
English,"scene_evt190627_cp4_q4_s10,7428441",detail,Sandalphon,"Rain? No, wait... Those black shadows are—"
English,"scene_evt190627_cp4_q4_s10,7428441",detail,Oceanographer,That's it! The documents are all in order!
English,"scene_evt190627_cp4_q4_s10,7428441",detail,Malluel,Great work. Now we just need Martin's opinion.
English,"scene_evt190627_cp4_q4_s10,7428441",detail,Oceanographer,Ah... That can wait for another time... Consider it a backup plan for if the presentation fails...
English,"scene_evt190627_cp4_q4_s10,7428441",detail,Halluel,Ellen. You're going to have to get a shark hunter's opinion sometime.
English,"scene_evt190627_cp4_q4_s10,7428441",detail,Azrael,"Martin's probably on the beach. And I want to sell some bean cakes to Sandy and the others anyway, so..."
English,"scene_evt190627_cp4_q4_s10,7428441",detail,Oceanographer,All right already! I'll go talk with him.
English,"scene_evt190627_cp4_q4_s10,7428441",detail,Oceanographer,"Waiter, check please!"
English,"scene_evt190627_cp4_q4_s10,7428441",detail,Shark,Sharrrk...
English,"scene_evt190627_cp4_q4_s10,7428441",detail,Oceanographer,Huh?
English,"scene_evt190627_cp4_q4_s10,7428441",detail,Malluel,Was that a... shark?
English,"scene_evt190627_cp4_q4_s10,7428441",detail,Halluel,That fell from the sky?
English,"scene_evt190627_cp4_q4_s10,7428441",detail,Azrael,Ah! There are tons of them!
English,"scene_evt190627_cp4_q4_s10,7428441",detail,Shark,Sharrrk!
English,"scene_evt190627_cp4_q4_s10,7428441",detail,,"In the blink of an eye, countless sharks come flying in from the ocean on newly sprouted wings."
English,"scene_evt190627_cp4_q4_s10,7428441",detail,,The party rushes into the chaos.
